{
  "decision_id": "DEC-2026-0002",
  "title": "Decision storage strategy: filesystem-first, DB-later index",
  "status": "decided",
  "layer": "delivery",
  "date": "2026-04-18",
  "context": "Current environment has no dedicated decision database, but decisions must remain traceable across interrupted sessions.",
  "decision": "Use filesystem decision records as authoritative source now; introduce DB indexing only after contract and governance model stabilize.",
  "consequences": [
    "Git history and pull requests provide immediate auditability without infra dependency.",
    "Searchability is acceptable for early stage via file naming and generated reports.",
    "A later DB index can mirror files for query performance without changing authority source."
  ],
  "owner": "Aurim Core",
  "related_paths": [
    "docs/foundation/decisions",
    "docs/foundation/decision-status.md",
    "tools/harness-runtime/scripts/governance_audit.py"
  ],
  "notes": "Revisit when decision records exceed manual review comfort threshold."
}
